nome,"localização anatômica",descrição,"nível energégico"
"Meridiano do Coração","Área central do tórax, próximo ao coração","Controla o sangue, os vasos sanguíneos e influencia as funções emocionais e mentais","Shao Yang da mão"
"Meridiano dos Pulmões","Região superior do tórax, incluindo os pulmões e área adjacente","Responsável pela respiração, imunidade, distribuição de energia e regulação do sistema respiratório","Tai Yin da mão"
"Meridiano do Fígado","Região do abdômen superior direito, abrangendo o fígado e área circundante","Regula o fluxo de energia, equilibra as emoções e suporta a função digestiva","Jue Yin da perna"
"Meridiano do Rim","Região lombar, incluindo a área dos rins e zona posterior","Armazena e regula a energia vital, governa o crescimento, desenvolvimento e reprodução","Shao Yin da perna"
"Meridiano do Estômago","Região central e superior do abdômen","Responsável pela digestão, absorção de nutrientes e transformação de alimentos","Yang Ming da perna"
"Meridiano do Intestino Delgado","Região do braço, ombro e parte superior do tronco","Auxilia na digestão, absorção de nutrientes e eliminação de resíduos","Tai Yang da mão"
"Meridiano do Pericárdio","Área ao redor do coração, incluindo o saco pericárdico","Protege o coração, regula as funções cardiovasculares e equilibra as emoções","Jue Yin da mão"
"Meridiano do Triplo Aquecedor","Região lateral do tronco, braços e pescoço","Coordena as funções dos três sistemas corporais (torácico, abdominal e pélvico), regula a temperatura e o metabolismo","San Jiao da mão"